{
  "schema_version": 1, "run_id": "offline-demo-1", "case_id": "hello",
  "source_sha256": "caf026f25d7140209f98072605307a438914b9ce6f3c14b23d15d9667241de52",
  "reference_profile": {"implementation": "CPython", "version": "3.13.7", "operating_environment": "Linux x86_64", "encoding": "UTF-8", "locale": "C.UTF-8", "timezone": "UTC", "working_directory_policy": "isolated temp directory", "environment_allowlist": [], "argv": [], "stdin": "", "hash_seed": "0", "resource_limits": {"cpu_seconds": 2, "wall_seconds": 3, "memory_bytes": 268435456, "process_count": 1, "output_bytes": 65536}},
  "attempt_index": 0, "repetition_index": 0, "planned": true, "status": "valid_prediction",
  "prediction": {"schema_version": 1, "mode": "strict", "original": {"termination": "completed", "stdout": "hi\n", "stderr": "", "exit_code": 0, "exception_type": null}, "improvised": null, "repairs": []},
  "observation": {"schema_version": 1, "stdout_b64": "aGkK", "stderr_b64": "", "return_code": 0, "elapsed_seconds": 0.002, "termination": "completed", "exception_type": null, "limit_event": null, "eligible": true, "exclusion_reason": null},
  "provider": "offline", "model": "fixture-model", "prompt_template": "v1", "prompt_sha256": null, "decoding_settings": {},
  "context_limit": 4096, "output_limit": 512, "seed": null, "latency_seconds": 0.1,
  "input_tokens": null, "output_tokens": null, "cost_amount": null, "cost_currency": null, "cost_provenance": null
}
